<?xml version="1.0" encoding="UTF-8"?>
<biblioteca xmlns:xsi="http://www.w3.org/2001/XMLSchema-instance"
xsi:noNamespaceSchemaLocation="biblioteca.xsd">
<libro categoria="noficcion" enstock="true" traductor="Joan Ros">
    <titulo>Sapiens</titulo>
    <autor>Yuval Harari</autor>
    <fecha>
        <mes>10</mes>
        <anyo>2015</anyo>
    </fecha>
    <ISBN>9788499926223</ISBN>
    <editor>Debate</editor>
</libro>
<libro categoria="ficcion">
    <titulo>Alfagann es Flanagan</titulo>
    <autor>Jaume Ribera</autor>
    <autor>Andreu Martín</autor>
    <fecha>
        <anyo>2009</anyo>
    </fecha>
    <ISBN>9788466784726</ISBN>
    <editor>Anaya</editor>
</libro>

<!-- Libros que no validan -->
<!-- libro con categoria no válida y sin editor -->
<libro categoria="manual">
    <titulo>Alfagann es Flanagan</titulo>
    <autor>Jaume Ribera</autor>
    <autor>Andreu Martín</autor>
    <fecha>
        <anyo>2009</anyo>
    </fecha>
    <ISBN>9788466784726</ISBN>
</libro>

<!-- libro con el mes no de tipo "tMes" e
     ISBN demasiado corto, no cumple su tipo "tISBN" -->
<libro categoria="ficcion">
    <titulo>Harry Potter y la piedra filosofal</titulo>
    <autor>J. K. Rowling</autor>
    <fecha>
        <mes>Marzo</mes>
        <anyo>1999</anyo>
    </fecha>
    <ISBN>978847888445</ISBN>
</libro>
</biblioteca>